Title,URL,Address,Compensation,Employment Type,Description
Architectural Senior Drafter/Job Captain,https://newyork.craigslist.org/mnh/egr/d/new-york-architectural-senior-drafter/7048463475.html,Midtown West,Competitive Salary - DOE,full-time,"
        
SBLM New York is looking for a highly motivated Senior Drafter/Job Captain who has a passion for understanding weather related problems that occur on existing older buildings.

Responsibilities include, but not limited to: 
Coordinate and develop construction documents
Take on technically challenging issues with Project Manager
Perform code and zoning analyses
Review and redline drawings
Oversee drafters as required
Produce deliverables without requiring constant supervision
Organize and lead site visits and surveys
Conduct material research and meet with vendor as necessary, to understand
materials and products
Take initiative to complete work

Requirements:
Bachelor’s Degree in Architecture
3 or more years’ experience in an Architect’s office
Must be proficient in AutoCAD, Revit and other applicable industry software
General understanding of codes and zoning
General knowledge of building details and construction administration 
Experience working with exterior envelope
Positive attitude and driven to succeed

. Compensation and Benefits:
•	We offer an excellent benefit package
•	Benefits include Medical/Dental/Vision insurance plans, 401k Retirement plan, Flexible Spending Plan which includes transportation, parking, and more. 
•	Salary commensurate with level of experience
•	Our company culture features professional learning and growth opportunities, rewarding project types to participate in and free ongoing professional educational program
•	Creative and innovative work environment
.

Interested candidates should forward their cover letter and resume 
Please include Senior Drafter/Job Captain in the subject. No phone calls, please.
    "
Designer/Architect,https://newyork.craigslist.org/mnh/egr/d/new-york-designer-architect/7048525636.html,Midtown West,Competitive Salary - DOE,full-time,"
        
SBLM Architects is a nationally recognized firm dedicated to realizing our clients’ goals through results-oriented architecture. The New York City headquarters and branch offices in Long Island, Miami, Dallas, and Dublin, IRL offer a wide range of services through five Design Studios: Mixed-use & Residential, Education, Retail & Commercial, Healthcare & Wellness, and Civic. 

The position is for a design role in the New York City headquarters office, located in the Hell’s Kitchen neighborhood of Manhattan. The position will support a wide range of projects primarily from the retail, mixed-use, education, and healthcare sectors. 

Requirements:
•	Bachelor’s or equivalent professional degree in Architecture
•	3-10 years of professional experience as a designer in an architectural office
•	Outstanding conceptual, planning and design skills
•	Ability to prepare construction documents and develop designs in documents
•	Strong skillset with Adobe Suite, Autodesk Software and a Modeling/Rendering package
•	Experience as a designer on built projects
•	Organizational skills and ability to work individually and to collaborate in a team
•	Clear and concise communication skills

During the interview candidates will be asked to demonstrate their experience and skillset for creating presentation materials for use in communicating their ideas to clientele, they will be asked to present an examples of their program-layout and planning experience, aesthetic decisions and justifications, and development of design concepts into design documents.   

Submissions:
Candidates should provide a resume and introduction on what they would bring to the position. 
They must include a portfolio of work via link or attachment. Attachments should not exceed 10MB and be in must be in PDF format.

Compensation and Benefits:
•	We offer an excellent benefit package
•	Benefits include Medical/Dental/Vision insurance plans, 401k Retirement plan, Flexible Spending Plan which includes transportation, parking, and more. 
•	Salary commensurate with level of experience
•	Our company culture features professional learning and growth opportunities, rewarding project types to participate in and free ongoing professional educational program
•	Creative and innovative work environment

Please submit resume and cover letter
    "
Electronic technician,https://newyork.craigslist.org/wch/egr/d/port-chester-electronic-technician/7048566280.html,PORT CHESTER or Tarrytown,to be discussed at interview,full-time,"
        
We're looking for a technician for a phone repair store. He/she has to be able to repair most electronics from phones to computers. Please send your resume to the posted email. Thank you.    "
Sales & Design Coordinator,https://newyork.craigslist.org/mnh/egr/d/new-york-sales-design-coordinator/7048605165.html,Murray Hill,"This role offers a competitive salary in addition to inclusion in the company’s profit sharing, 401K, medical, and dental programs.",full-time,"
        
Amuneal Manufacturing Corp. has an immediate opening in our New York Showroom for a Sales & Design Coordinator.  This role will focus on our luxury furniture and architectural product offerings. This role is primarily responsible for customer support and collaboration with our Sales + Design team.  

Confidence, a clean design aesthetic, the ability to spark interest in others, direct customer interaction and experience in the selling of high-end designed products are a must. Candidates must have the ability to organize their own time, multitask in a dynamic environment, be proactive, and above all else…problem solve. We are looking for someone who is eager to connect with people and translate their needs into timeless experiences and products. To be successful, candidates must have a strong interest in the creation of high-end products. Candidates must be looking for a role where they are part of a collaborative environment and able to make an impact on the organization each day.








Please submit both resume and cover letter for consideration.


    "
Project Manager/Site Superintendent,https://newyork.craigslist.org/que/egr/d/long-island-city-project-manager-site/7048647059.html,NYC,TBD,full-time,"
        
To provide Management, Supervision and coordination for all phases of NYC School Construction Authority projects, including coordinating subcontractors, material and equipment, ensuring that specifications are being strictly followed, and work is proceeding on schedule and within budget. PM/Superintendent shall be responsible for scheduling, inspections, quality control, and job site safety. 

Essential Functions / Major Responsibilities of PM/Superintendent: 
 
Schedule subcontractors, consultants, and vendors in critical path to ensure timely completion.  
Perform quality control duties and responsibilities regarding the work being performed.  
Communicate with project team regarding Change Orders, RFI’s, and Material Submittals. 
Ensure that subcontractors are fully executing and complying with his contracted scope of work.  
Coordinate required inspections with local owner QA-QC and Controlled lab.  
Identify subcontractor non-compliance with safety, health, and environmental quality standards.  
Identify conflicts in construction progress and communicate them to project team for resolution.  
Maintain daily log (written) of activities on the jobsite.  
 Ensure subcontractor has corrected all deficiencies identified by project team.  
Preside over weekly subcontractor meetings designed to coordinate the work.  
Issue notices of non-compliance to subcontractors in regards to quality of work or scheduling or safety.  
Ensure that the job site is always kept in a clean and organized manner.  
Perform job progress and completion punch list identification and completion. 
 
Secondary Functions:  
 
Assist in budgeting, bidding, and award of subcontracts.  
Assist in obtaining permits or approval of revisions.  
Gather project material submittals and maintain records of approvals at the job-site.  
Preside at pre-construction meeting with each subcontractor.  
Assist in hiring sub-tier employees. 

    "
ARCHITECT / DRAFTER,https://newyork.craigslist.org/brk/egr/d/brooklyn-architect-drafter/7048900445.html,Brooklyn,Based on qualification,full-time,"
        
Busy Design and Consulting firm is looking for a talented individual to join our team.

Our work includes renovations and ground ups of small, medium and large scale single and multi-family residential, commercial, community facility and mixed-use projects.

Responsibilities will include production of design development and construction documents, Candidates must be self-motivated, reliable and able to manage all aspects of a project.

Candidate Qualifications:
Be familiar with NYC codes and zoning.
Knowledge of construction materials, details and methods.
Proficiency in Revit and AutoCAD.

We are looking for highly motivated individuals who are willing to take on responsibility and grow with our team. Interested applicants must be quick to learn and adapt new drawing methods, related zoning & code rules, DOB and related agency requirements. detail-oriented, collaborative, and eager to take on challenges

Qualified individuals should submit a *brief description of your qualifications, *work samples, *starting salary requirements, in pdf or word format    "
Structural Engineer,https://newyork.craigslist.org/que/egr/d/structural-engineer/7048984818.html,Rego Park,medical coverage,full-time,"
        
R & O Engineering, PC one of the leading Structural Engineering Company in Queens, NY is seeking a full time Structural Engineer. Responsibilities for this job includes planing, reviewing, and finalizing projects according to deadlines.

REQUIREMENTS AND RESPONSIBILITIES

· BS or MS degree in Structural or Civil Engineering.
. Structural analysis and design- more than three years.
· Excellent communication skills (internal and external).
· Experience in NYC projects, working knowledge of New York City codes.
· Manage multiple projects.
· Ability to effectively manage multiple tasks and projects in the same time.
· Proven ability to successfully deliver projects on time.
. Engineering of steel, light gauge design, masonry design and Concrete superstructures.
. Design of structural  systems for small complex buildings.
· Visual acuity adequate to perform job duties, including reading information from printed sources and computer screen.
. Be informed and communicative about new and old projects.
. Coordinate and respond to client requests for changes in project scope, address revisions.
. Knowledge of structural software skills including AutoCAD, Etabs, RAM, Safe, and PCA, 

R & O Engineering is proud to be an equal opportunity employer. We offer a competitive salary and good benefits package, including healthcare benefits. Interested candidates, please forward resume and salary requirements.

Job Type: Full-time

    "
Class 2 Senior Project Manager / Code Consultant,https://newyork.craigslist.org/mnh/egr/d/new-york-class-2-senior-project-manager/7048988980.html,Midtown West,"Competitive Compensation- commensurate with experience and includes health, dental and vision options available. Paid vacation, personal, and sick days as well.",full-time,"
        
A Manhattan based full-service expediting, building compliance and consulting firm, is seeking a full-time, experienced Senior Project Manager / Code Consultant who possesses a Class 2 DOB License.

Required Credentials for Position:
•	Active NYC DOB Code and Zoning Representative Class 2 License & FDNY File Rep ID
•	Minimum five to ten (5-10) years of relevant experience and working with agencies such as DOB, FDNY, 
        ECB, DEP...etc.
•	Ability to attend appointments with Department of Buildings Plan Examiners to review and answer 
        objections and report back to the superiors
•	Ability to attend Environmental Control Board Hearings and aid in dismissing open violations (A PLUS)
•	Responsible for following up on all submissions and report Department of Buildings findings to the office
•	Review architectural and engineering plans for compliance to applicable building codes and zoning 
        regulations.
•	Distribute the forms to the architect, engineer, building owner, contractor, etc., in order to obtain the 
        required signatures and seals.
•	Coordinate the submission of the architectural and or engineering plans to DOB.
•	Correspondence and communication with the architect, engineer, building owner, contractor, etc. to resolve 
        DOB objections and obtain approval and work permits.
•	Serve as a liaison between the field personnel and the architect, engineer, building owner, contractor, etc. to 
        resolve DOB objections and obtain approval and work permits and sign-offs.
•	Experience with the preparation of DOB forms, permits and violation documentation
•	Experience with Development Hub
•	Experience with DOB NOW
•	Able to use Microsoft Office Suite (OUTLOOK, WORD, EXCEL)
•	Responsible for following up on all projects
•	Professional attitude with great communication (written and verbal) and organizational skills a must
•	Ability to the follow office protocols and procedures a must
•	Team Player with strong Project Management skills

Education Requirements:
•	College Degree in Related Field (preferred)

Compensation: Competitive Compensation- commensurate with experience and includes health, dental and vision options available. Paid vacation, personal, and sick days as well.

Job Type: Full-time
    "
Project Manager (DOB Class 1 or 2 ID),https://newyork.craigslist.org/mnh/egr/d/new-york-project-manager-dob-class-1-or/7048996998.html,Midtown West,"Competitive Compensation- commensurate with experience and includes health, dental and vision options available. Paid vacation, personal, and sick days as well.",full-time,"
        
A Manhattan based full-service expediting and consulting firm, is seeking a full-time, experienced Project Manager with a Class 1 or 2 DOB File Rep ID

Required Credentials for Position:
• Active NYC DOB Code and Zoning Representative Class 1 or 2 License
• Minimum five (5) years of relevant experience with filing procedures at DOB, FDNY, LPC, DEP, DOT, MTA,
  ECB...etc.
• Ability to attend appointments with Department of Buildings Plan Examiners to review and answer
  objections and report back to the superiors
• Responsible for following up on all submissions
• Report Department of Buildings findings to the office
• Professional attitude with great communication (written and verbal) and organizational skills a must
• Able to use Microsoft Office Suite (outlook, word, excel)
• Ability to the follow office protocols and procedures a must
• Experience with the preparation of DOB application forms and permits a plus
• Experience with Development Hub 
• Experience with DOB NOW
• Active FDNY ID a plus
• Knowledge and understanding of construction plans and documents a plus
• Punctual

Education Requirements:
• College Degree in Related Field (preferred)

Compensation: Competitive Compensation- commensurate with experience and includes health, dental and vision options available. Paid vacation, personal, and sick days as well.

Note: Principals only. Recruiters, please don't contact this job poster. DO NOT contact us with unsolicited services or offers

Job Type: Full-time
    "
engineer- structural,https://newyork.craigslist.org/mnh/egr/d/new-york-engineer-structural/7049049876.html,new york,good compensation and advancement opportunities,full-time,"
        
Project structural engineer for design of building projects. 
Good communication skills required.
    "
Project Architect(s),https://newyork.craigslist.org/que/egr/d/project-architects/7049134553.html,"Jamaica, Queens",Commensurate with Experience,full-time,"
        
Mssa, a Small Successful 8-Person Architectural studio based in Queens is seeking Project Architect(s). Our projects include single-family residential, multifamily, and mixed-use hospitality projects. The studio offers an opportunity to be involved in all phases of the urban built environment from Design Development, Construction Documents, Consultant Coordination and City Approvals to Project Close up. The candidate shall be willing to work on a whole range of projects from small extensions to multifamily and hospitality.

Requirements
• BS or 5-year Professional degree in Architecture
• Minimum 3 years US experience in an architecture office
• Proven ability to produce Construction Documents
• Working knowledge of NYC code and zoning regulations
• Familiarity with DOB procedures a plus
• Site visits and requisition review
• Check submittals and respond to requests for information
• Fluent with Autocad Architecture 2017/18
• Revit 2017 Experience a plus
• Strong work ethic 
• Fluent English 

Please submit your resume including work samples with a particular emphasis on construction documents.
    "
Facade / Building Envelope Project Manager,https://newyork.craigslist.org/mnh/egr/d/facade-building-envelope-project-manager/7049329298.html,TriBeCa,Commensurate with experience,full-time,"
        
 
 , New York City's leading professional firm dedicated to the preservation of buildings and infrastructure, is seeking a resourceful, skilled structural engineer or architect with 5 to 6 years of building envelope restoration experience if licensed, and 7 to 10 years' experience if not licensed, to join us as a Project Manager  in executing a growing slate of challenging projects. 

We work on an array of building types, including courthouses, schools, universities, churches, and hospitals, and many of New York's most storied landmarks, from Trinity Church to Grand Central Terminal. Our work embraces all components of the building envelope and underlying structure—facades, roofs, windows, and plazas—and the full complement of materials, from historic terra-cotta to high-performance curtain walls. We’re proud to be an industry leader in crucial practice areas like Local Law 11 inspections and repairs. We've won numerous awards, as well as the loyalty of many of the premier public, corporate, and residential clients in the region. 

You’ll work as part of a small team assigned to projects based on synergies between project requirements and the capabilities of each team member. This arrangement offers employees the dual advantages of a small office experience coupled with access to the centralized resources of a larger firm. You'll be supported by some of the most sophisticated technology in the profession, including proprietary computer systems and applications, advanced photography and image processing, and state-of-the-art, non-destructive diagnostic equipment and techniques. 

Typically, you’ll participate in all phases of a project from inception through completion: proposal, investigation, construction documents, bid negotiation, and construction administration. You'll have the opportunity to see your designs executed in the field and you'll take on greater responsibility and client management as soon as you are ready. 

We offer an array of benefits and growth opportunities: :


Our light-filled Tribeca office is in a landmarked building with 16' high ceilings, 8' tall windows, and stunning views of Manhattan in three directions—not a bad place to spend the work day. We’re easily accessible via public transportation: the A, C, and E Canal Street station connects directly to our building’s lobby. The N, R, 1, and 6 lines are all just a few blocks away. 

If you’re excited about this opportunity, please send us your resume, a cover letter with salary requirements, and a few pages of attachments (maximum of 10MB, please) or link to your portfolio that demonstrates your experience and capabilities. 

With thanks for your interest, please note that only those candidates under consideration will be contacted. 

For additional information on our firm’s services, approach, and projects, visit 
    "
Facade / Building Envelope Architect,https://newyork.craigslist.org/mnh/egr/d/facade-building-envelope-architect/7049330903.html,TriBeCa,Commensurate with experience,full-time,"
        
 

 New York City's leading professional firm dedicated to the preservation of buildings and infrastructure, is seeking a resourceful, skilled architect with 2-5 years’ relevant experience to join us in executing a growing slate of challenging projects.  
 
We’re proud to be an industry leader in crucial practice areas like facade inspections and repairs (Local Law 11), roof repairs, and investigation and remediation of structural issues. We've won numerous awards—including ten Lucy Moses preservation awards—as well as the loyalty of many of the premier public, corporate, and residential clients in the region.  

Absolutely. You'll be supported by some of the most sophisticated technology in the profession, including proprietary computer applications that integrate construction drawings, specifications, cost estimating, scheduling, and construction administration; advanced photography and image processing; and state-of-the-art, non-destructive diagnostic equipment and techniques. In fact, we have an in-house studio dedicated to such supporting technology, constantly developing new digital tools (think James Bond’s “Q”).    .

 
Honestly, we offer aspects of both. You’ll work as part of a small team assigned to projects based on synergies between project requirements and the capabilities of each team member. This gives you the dual advantages of a small office experience coupled with access to the centralized resources of a larger firm.  

You’ll participate in all phases of a project from inception through completion: proposal, investigation, construction documents, bid negotiation, and construction administration. You'll have the opportunity to see your designs executed in the field and you'll take on greater responsibility and client management as soon as you are ready. 

An array of building types, including courthouses, schools, universities, churches, and hospitals, and many of New York's most storied landmarks.  
 
We embrace all components of the building envelope and underlying structure—facades, roofs, windows, and plazas—and the full complement of materials, from historic terra-cotta to high-performance curtain walls.  


We offer an array of benefits and growth opportunities:





Our light-filled Tribeca office is in a landmarked building with 16' high ceilings, 8' tall windows, and stunning views of Manhattan in three directions—not a bad place to spend the work day. We’re easily accessible via public transportation: the A, C, and E Canal Street station connects directly to our building’s lobby. The N, R, 1, and 6 lines are all just a few blocks away.



Send us your resume, a cover letter with salary requirements, and a few pages of attachments (maximum of 10MB, please) or a link to your portfolio that demonstrates your experience and capabilities. We look forward to meeting you! 

Please note that, due to the high number of applicants, we can only contact candidates under consideration.   

For additional information on our firm’s services, approach, and projects, visit 
    "
Job- Casting: Are you in love with an international student,https://newyork.craigslist.org/mnh/egr/d/new-york-job-casting-are-you-in-love/7049335229.html,Midtown,Will be paid if chosen for the series,contract,"
        
Are you in a relationship with an international student? Are you in a serious relationship with an international student attending a school in the United States? Glass Entertainment Group is teaming up with a major cable network to follow couples where one person in the relationship is a U.S. citizen and the other is in the country on a student visa that is expiring in Spring/Summer 2020. 

If you think you and your partner are a good fit, please reply with a small description of your relationship as well as your contact info and photo.

We look forward to hearing from you.    "
Drafter/Estimator Experienced in steel fabrication,https://newyork.craigslist.org/que/egr/d/flushing-drafter-estimator-experienced/7049531546.html,college point queens,25,full-time,"
        
We are seeking an in house person experienced in steel fabrication to detail our incoming jobs and do takeoffs for bidding on projects as well.Must be somewhat experienced. Please reply in detail for interview,thanks.    "
